url,doi,publisher,month,year,pages,number,volume,journal,author,title,ENTRYTYPE,ID,copyright,keywords,abstract,eprint
https://doi.org/10.1088%2F2058-9565%2Fac3e54,10.1088/2058-9565/ac3e54,IOP Publishing,2,2022,015021,1,7,Quantum Science and Technology,"Amaro, David and Modica, Carlo and Rosenkranz, Matthias and Fiorentini, Mattia and Benedetti, Marcello and Lubasch, Michael",Filtering variational quantum algorithms for combinatorial optimization,article,10.1088/2058-9565/ac3e54,,,,
https://arxiv.org/abs/2109.04840,10.48550/ARXIV.2109.04840,arXiv,9,2021,,,,,"Herbert, Steven and Guichard, Roland and Ng, Darren",Noise-Aware Quantum Amplitude Estimation,article,https://doi.org/10.48550/arxiv.2109.04840,"arXiv.org perpetual, non-exclusive license","Quantum Physics (quant-ph), FOS: Physical sciences, FOS: Physical sciences",,
https://arxiv.org/abs/2206.07559,10.48550/ARXIV.2206.07559,arXiv,6,2022,,,,,"Duffield, Samuel and Benedetti, Marcello and Rosenkranz, Matthias",Bayesian Learning of Parameterised Quantum Circuits,article,https://doi.org/10.48550/arxiv.2206.07559,"arXiv.org perpetual, non-exclusive license","Quantum Physics (quant-ph), Machine Learning (stat.ML), FOS: Physical sciences, FOS: Physical sciences, FOS: Computer and information sciences, FOS: Computer and information sciences",,
https://arxiv.org/abs/2206.08811,10.48550/ARXIV.2206.08811,arXiv,6,2022,,,,,"Fontana, Enrico and Rungger, Ivan and Duncan, Ross and Cîrstoiu, Cristina",Spectral analysis for noise diagnostics and filter-based digital error mitigation,article,https://doi.org/10.48550/arxiv.2206.08811,"arXiv.org perpetual, non-exclusive license","Quantum Physics (quant-ph), FOS: Physical sciences, FOS: Physical sciences",,
https://onlinelibrary.wiley.com/doi/abs/10.1002/qua.26975,https://doi.org/10.1002/qua.26975,,8,2022,e26975,22,122,International Journal of Quantum Chemistry,"Kirsopp, Josh J. M. and Di Paola, Cono and Manrique, David Zsolt and Krompiec, Michal and Greene-Diniz, Gabriel and Guba, Wolfgang and Meyder, Agnes and Wolf, Detlef and Strahm, Martin and Muñoz Ramo, David",Quantum computational quantification of protein–ligand interactions,article,https://doi.org/10.1002/qua.26975,,,Abstract We have demonstrated a prototypical hybrid classical and quantum computational workflow for the quantification of protein–ligand interactions. The workflow combines the density matrix embedding theory (DMET) embedding procedure with the variational quantum eigensolver (VQE) approach for finding molecular electronic ground states. A series of β -secretase (BACE1) inhibitors is rank-ordered using binding energy differences calculated on the latest superconducting transmon (IBM) and trapped-ion (Quantinuum) noisy intermediate scale quantum (NISQ) devices. This is the first application of real quantum computers to the calculation of protein-ligand binding energies. The results shed light on hardware and software requirements which would enable the application of NISQ algorithms in drug design.,https://onlinelibrary.wiley.com/doi/pdf/10.1002/qua.26975
https://arxiv.org/abs/2211.06703,10.48550/ARXIV.2211.06703,arXiv,11,2022,,,,,"Self, Chris N. and Benedetti, Marcello and Amaro, David",Protecting Expressive Circuits with a Quantum Error Detection Code,misc,https://doi.org/10.48550/arxiv.2211.06703,"arXiv.org perpetual, non-exclusive license","Quantum Physics (quant-ph), FOS: Physical sciences, FOS: Physical sciences",,
