url,doi,publisher,pages,number,volume,month,year,journal,author,title,ENTRYTYPE,ID,place,issn,copyright,keywords,numpages,issue,abstract,day,primaryclass,archiveprefix,eprint,note
https://doi.org/10.1002%2Fqute.202100081,10.1002/qute.202100081,Wiley,2100081,3,5,1,2022,Advanced Quantum Technologies,Meron Sheffer and Daniel Azses and Emanuele G. Dalla Torre,Playing Quantum Nonlocal Games with Six Noisy Qubits on the Cloud,article,10.1002/qute.202100081,,,,,,,,,,,,
https://www.osti.gov/biblio/1818586,10.22331/q-2021-09-02-535,Quantum,,,5,9,2021,Quantum,"Yirka, Justin and Subaşı, Yiğit",Qubit-efficient entanglement spectroscopy using qubit resets,article,10.22331/q-2021-09-02-535,Austria,2521-327X,,,,,,,,,,
https://doi.org/10.22331%2Fq-2021-12-23-609,10.22331/q-2021-12-23-609,Verein zur Forderung des Open Access Publizierens in den Quantenwissenschaften,609,,5,12,2021,Quantum,Arthur G. Rattew and Yue Sun and Pierre Minssen and Marco Pistoia,The Efficient Preparation of Normal Distributions in Quantum Registers,article,10.22331/q-2021-12-23-609,,,,,,,,,,,,
https://arxiv.org/abs/2006.10656,10.48550/ARXIV.2006.10656,arXiv,,,,6,2020,,"Gilliam, Austin and Pistoia, Marco and Gonciulea, Constantin",Canonical Construction of Quantum Oracles,article,https://doi.org/10.48550/arxiv.2006.10656,,,"arXiv.org perpetual, non-exclusive license","Quantum Physics (quant-ph), Emerging Technologies (cs.ET), FOS: Physical sciences, FOS: Physical sciences, FOS: Computer and information sciences, FOS: Computer and information sciences",,,,,,,,
https://arxiv.org/abs/2007.10894,10.48550/ARXIV.2007.10894,arXiv,,,,7,2020,,"Gilliam, Austin and Pistoia, Marco and Gonciulea, Constantin",Optimizing Quantum Search with a Binomial Version of Grover's Algorithm,article,https://doi.org/10.48550/arxiv.2007.10894,,,"arXiv.org perpetual, non-exclusive license","Quantum Physics (quant-ph), Emerging Technologies (cs.ET), FOS: Physical sciences, FOS: Physical sciences, FOS: Computer and information sciences, FOS: Computer and information sciences",,,,,,,,
https://arxiv.org/abs/2109.09787,10.48550/ARXIV.2109.09787,arXiv,,,,9,2021,,"Sewell, Troy J. and Jordan, Stephen P.",Preparing Renormalization Group Fixed Points on NISQ Hardware,article,https://doi.org/10.48550/arxiv.2109.09787,,,Creative Commons Attribution 4.0 International,"Quantum Physics (quant-ph), Statistical Mechanics (cond-mat.stat-mech), Strongly Correlated Electrons (cond-mat.str-el), FOS: Physical sciences, FOS: Physical sciences",,,,,,,,
https://arxiv.org/abs/2110.00507,10.48550/ARXIV.2110.00507,arXiv,,,,10,2021,,"MacCormack, Ian and Galda, Alexey and Lyon, Adam L.",Simulating Large PEPs Tensor Networks on Small Quantum Devices,article,https://doi.org/10.48550/arxiv.2110.00507,,,"arXiv.org perpetual, non-exclusive license","Quantum Physics (quant-ph), Strongly Correlated Electrons (cond-mat.str-el), FOS: Physical sciences, FOS: Physical sciences",,,,,,,,
https://arxiv.org/abs/2110.15958,10.48550/ARXIV.2110.15958,arXiv,,,,10,2021,,"Yalovetzky, Romina and Minssen, Pierre and Herman, Dylan and Pistoia, Marco",NISQ-HHL: Portfolio Optimization for Near-Term Quantum Hardware,article,https://doi.org/10.48550/arxiv.2110.15958,,,Creative Commons Attribution 4.0 International,"Quantum Physics (quant-ph), FOS: Physical sciences, FOS: Physical sciences",,,,,,,,
https://doi.org/10.1038/s42005-022-01089-6,10.1038/s42005-022-01089-6,Nature Physics,,,,1,2023,,"Mukherjee, Anirban and Berthusen, Noah F. and Getelina, Jo{\~a}o C. and Orth, Peter P. and Yao, Yong-Xin",Comparative study of adaptive variational quantum eigensolvers for multi-orbital impurity models,article,Mukherjee2023,,,,,,,,,,,,
,10.1109/TQE.2022.3184764,,1-19,,3,5,2022,IEEE Transactions on Quantum Engineering,"Pelofske, Elijah and Bärtschi, Andreas and Eidenbenz, Stephan",Quantum Volume in Practice: What Users Can Expect From NISQ Devices,article,9805433,,,,,,,,,,,,
https://arxiv.org/abs/2205.00125,10.48550/ARXIV.2205.00125,arXiv,,,,5,2022,,"Pelofske, Elijah and Bärtschi, Andreas and Garcia, Bryan and Kiefer, Boris and Eidenbenz, Stephan",Quantum Telecloning on NISQ Computers,article,https://doi.org/10.48550/arxiv.2205.00125,,,"arXiv.org perpetual, non-exclusive license","Quantum Physics (quant-ph), Data Structures and Algorithms (cs.DS), Emerging Technologies (cs.ET), FOS: Physical sciences, FOS: Physical sciences, FOS: Computer and information sciences",,,,,,,,
https://arxiv.org/abs/2206.03144,10.48550/ARXIV.2206.03144,arXiv,,,,6,2022,,"Niu, Siyuan and Todri-Sanial, Aida",Multi-programming Cross Platform Benchmarking for Quantum Computing Hardware,article,https://doi.org/10.48550/arxiv.2206.03144,,,"arXiv.org perpetual, non-exclusive license","Quantum Physics (quant-ph), FOS: Physical sciences, FOS: Physical sciences",,,,,,,,
https://arxiv.org/abs/2206.05343,10.48550/ARXIV.2206.05343,arXiv,,,,6,2022,,"Lotshaw, Phillip C. and Xu, Hanjing and Khalid, Bilal and Buchs, Gilles and Humble, Travis S. and Banerjee, Arnab",Simulations of Frustrated Ising Hamiltonians with Quantum Approximate Optimization,article,https://doi.org/10.48550/arxiv.2206.05343,,,Creative Commons Attribution Non Commercial No Derivatives 4.0 International,"Quantum Physics (quant-ph), Materials Science (cond-mat.mtrl-sci), FOS: Physical sciences, FOS: Physical sciences",,,,,,,,
https://arxiv.org/abs/2207.14313,10.48550/ARXIV.2207.14313,arXiv,,,,7,2022,,"Hahn, Dominik and Dupont, Maxime and Schmitt, Markus and Luitz, David J. and Bukov, Marin",Verification of the Quantum Jarzynski Equality on Digital Quantum Computers,article,https://doi.org/10.48550/arxiv.2207.14313,,,Creative Commons Attribution 4.0 International,"Statistical Mechanics (cond-mat.stat-mech), Disordered Systems and Neural Networks (cond-mat.dis-nn), Quantum Gases (cond-mat.quant-gas), Strongly Correlated Electrons (cond-mat.str-el), Quantum Physics (quant-ph), FOS: Physical sciences, FOS: Physical sciences",,,,,,,,
https://arxiv.org/abs/2209.09371,10.48550/ARXIV.2209.09371,arXiv,,,,9,2022,,"Akhalwaya, Ismail Yunus and Ubaru, Shashanka and Clarkson, Kenneth L. and Squillante, Mark S. and Jejjala, Vishnu and He, Yang-Hui and Naidoo, Kugendran and Kalantzis, Vasileios and Horesh, Lior",Towards Quantum Advantage on Noisy Quantum Computers,article,https://doi.org/10.48550/arxiv.2209.09371,,,"arXiv.org perpetual, non-exclusive license","Quantum Physics (quant-ph), Machine Learning (cs.LG), Numerical Analysis (math.NA), FOS: Physical sciences, FOS: Physical sciences, FOS: Computer and information sciences, FOS: Computer and information sciences, FOS: Mathematics, FOS: Mathematics",,,,,,,,
https://arxiv.org/abs/2209.15024,10.48550/ARXIV.2209.15024,arXiv,,,,9,2022,,"Herman, Dylan and Shaydulin, Ruslan and Sun, Yue and Chakrabarti, Shouvanik and Hu, Shaohan and Minssen, Pierre and Rattew, Arthur and Yalovetzky, Romina and Pistoia, Marco",Portfolio Optimization via Quantum Zeno Dynamics on a Quantum Processor,article,https://doi.org/10.48550/arxiv.2209.15024,,,"arXiv.org perpetual, non-exclusive license","Quantum Physics (quant-ph), FOS: Physical sciences, FOS: Physical sciences",,,,,,,,
https://link.aps.org/doi/10.1103/PhysRevA.106.032613,10.1103/PhysRevA.106.032613,American Physical Society,032613,,106,9,2022,Phys. Rev. A,"Delaney, Conor and Seshadreesan, Kaushik P. and MacCormack, Ian and Galda, Alexey and Guha, Saikat and Narang, Prineha",Demonstration of a quantum advantage by a joint detection receiver for optical communication using quantum belief propagation on a trapped-ion device,article,PhysRevA.106.032613,,,,,10,3,,,,,,
https://doi.org/10.1038/s41567-022-01696-8,10.1038/s41567-022-01696-8,,970-971,9,18,9,2022,Nature Physics,"Tagliacozzo, Luca",Optimal simulation of quantum dynamics,article,Tagliacozzo2022,,1745-2481,,,,,Tensor networks are mathematical structures that efficiently compress the data required to describe quantum systems. An algorithm for the optimal simulation of quantum dynamics based on tensor networks has now been implemented on a trapped-ion processor.,1,,,,
https://doi.org/10.1209%2F0295-5075%2Fac90e6,10.1209/0295-5075/ac90e6,IOP Publishing,18002,1,140,9,2022,Europhysics Letters,K. Zhang and K. Yu and V. Korepin,Quantum search on noisy intermediate-scale quantum devices,article,Zhang_2022,,,,,,,,,,,,
https://arxiv.org/abs/2210.03048,10.48550/ARXIV.2210.03048,arXiv,,,,10,2022,,"Aktar, Shamminuj and Bärtschi, Andreas and Badawy, Abdel-Hameed A. and Eidenbenz, Stephan",Scalable Experimental Bounds for Entangled Quantum State Fidelities,article,https://doi.org/10.48550/arxiv.2210.03048,,,"arXiv.org perpetual, non-exclusive license","Quantum Physics (quant-ph), Data Structures and Algorithms (cs.DS), FOS: Physical sciences, FOS: Physical sciences, FOS: Computer and information sciences, FOS: Computer and information sciences",,,,,,,,
https://arxiv.org/abs/2210.10164,10.48550/ARXIV.2210.10164,arXiv,,,,10,2022,,"Pelofske, Elijah and Bärtschi, Andreas and Eidenbenz, Stephan",Optimized Telecloning Circuits: Theory and Practice of Nine NISQ Clones,article,https://doi.org/10.48550/arxiv.2210.10164,,,"arXiv.org perpetual, non-exclusive license","Quantum Physics (quant-ph), Data Structures and Algorithms (cs.DS), FOS: Physical sciences, FOS: Physical sciences, FOS: Computer and information sciences, FOS: Computer and information sciences",,,,,,,,
https://doi.org/10.1038/s41598-022-20853-w,10.1038/s41598-022-20853-w,,17171,1,12,10,2022,Scientific Reports,"Niroula, Pradeep and Shaydulin, Ruslan and Yalovetzky, Romina and Minssen, Pierre and Herman, Dylan and Hu, Shaohan and Pistoia, Marco",Constrained quantum optimization for extractive summarization on a trapped-ion quantum computer,article,Niroula2022,,2045-2322,,,,,"Realizing the potential of near-term quantum computers to solve industry-relevant constrained-optimization problems is a promising path to quantum advantage. In this work, we consider the extractive summarization constrained-optimization problem and demonstrate the largest-to-date execution of a quantum optimization algorithm that natively preserves constraints on quantum hardware. We report results with the Quantum Alternating Operator Ansatz algorithm with a Hamming-weight-preserving XY mixer (XY-QAOA) on trapped-ion quantum computer. We successfully execute XY-QAOA circuits that restrict the quantum evolution to the in-constraint subspace, using up to 20 qubits and a two-qubit gate depth of up to 159. We demonstrate the necessity of directly encoding the constraints into the quantum circuit by showing the trade-off between the in-constraint probability and the quality of the solution that is implicit if unconstrained quantum optimization methods are used. We show that this trade-off makes choosing good parameters difficult in general. We compare XY-QAOA to the Layer Variational Quantum Eigensolver algorithm, which has a highly expressive constant-depth circuit, and the Quantum Approximate Optimization Algorithm. We discuss the respective trade-offs of the algorithms and implications for their execution on near-term quantum hardware.",13,,,,
https://link.aps.org/doi/10.1103/PhysRevD.106.114515,10.1103/PhysRevD.106.114515,American Physical Society,114515,,106,12,2022,Phys. Rev. D,"Asaduzzaman, Muhammad and Toga, Goksu Can and Catterall, Simon and Meurice, Yannick and Sakai, Ryo",Quantum simulation of the $N$-flavor Gross-Neveu model,article,PhysRevD.106.114515,,,,,11,11,,,,,,
https://arxiv.org/abs/2301.11005,10.48550/ARXIV.2301.11005,arXiv,,,,1,2023,,"Hegade, Narendra N. and Solano, Enrique",Digitized-counterdiabatic quantum factorization,article,https://doi.org/10.48550/arxiv.2301.11005,,,Creative Commons Attribution 4.0 International,"Quantum Physics (quant-ph), Mesoscale and Nanoscale Physics (cond-mat.mes-hall), FOS: Physical sciences, FOS: Physical sciences",,,,,,,,
https://link.springer.com/article/10.1186/s41313-022-00049-5,https://doi.org/10.1186/s41313-022-00049-5,,,1,7,1,2023,,"Song, Duo and Bauman, Nicholas P and G. Prawiroatmodjo and Peng, Bin and Granade, Cassandra and Rosso, Kevin M and Guang Hao Low and Roetteler, Martin and Kowalski, Karol and Bylaska, Eric J",Periodic plane-wave electronic structure calculations on quantum computers,article,https://doi.org/10.1186/s41313-022-00049-5,,,,,,,,,,,,
https://arxiv.org/abs/2301.07841,10.48550/ARXIV.2301.07841,arXiv,,,,1,2023,,"Balewski, Jan and Amankwah, Mercy G. and Van Beeumen, Roel and Bethel, E. Wes and Perciano, Talita and Camps, Daan",Quantum-parallel vectorized data encodings and computations on trapped-ions and transmons QPUs,article,https://doi.org/10.48550/arxiv.2301.07841,,,"arXiv.org perpetual, non-exclusive license","Quantum Physics (quant-ph), FOS: Physical sciences, FOS: Physical sciences",,,,,,,,
https://link.aps.org/doi/10.1103/PhysRevD.107.023007,10.1103/PhysRevD.107.023007,American Physical Society,023007,,107,1,2023,Phys. Rev. D,"Amitrano, Valentina and Roggero, Alessandro and Luchi, Piero and Turro, Francesco and Vespucci, Luca and Pederiva, Francesco",Trapped-ion quantum simulation of collective neutrino oscillations,article,PhysRevD.107.023007,,,,,15,2,,,,,,
https://arxiv.org/abs/2302.01917,10.48550/ARXIV.2302.01917,arXiv,,,,1,2023,,"Iqbal, Mohsin and Tantivasadakarn, Nathanan and Gatterman, Thomas M. and Gerber, Justin A. and Gilmore, Kevin and Gresh, Dan and Hankin, Aaron and Hewitt, Nathan and Horst, Chandler V. and Matheny, Mitchell and Mengle, Tanner and Neyenhuis, Brian and Vishwanath, Ashvin and Foss-Feig, Michael and Verresen, Ruben and Dreyer, Henrik",Topological Order from Measurements and Feed-Forward on a Trapped Ion Quantum Computer,article,https://doi.org/10.48550/arxiv.2302.01917,,,"arXiv.org perpetual, non-exclusive license","Quantum Physics (quant-ph), Strongly Correlated Electrons (cond-mat.str-el), FOS: Physical sciences, FOS: Physical sciences",,,,,,,,
https://arxiv.org/abs/2302.03888,10.48550/ARXIV.2302.03888,arXiv,,,,1,2023,,"Moosa, Mudassir and Watts, Thomas W. and Chen, Yiyou and Sarma, Abhijat and McMahon, Peter L.",Linear-depth quantum circuits for loading Fourier approximations of arbitrary functions,article,https://doi.org/10.48550/arxiv.2302.03888,,,Creative Commons Attribution 4.0 International,"Quantum Physics (quant-ph), FOS: Physical sciences, FOS: Physical sciences",,,,,,,,
https://arxiv.org/abs/2303.02064,,,,,,3,2023,,Ruslan Shaydulin and Marco Pistoia,QAOA with $N\cdot p\geq 200$,article,shaydulin2023qaoa,,,,,,,,,quant-ph,arXiv,2303.02064,
https://arxiv.org/abs/2303.02209,,,,,,3,2023,,Timo Eckstein and Refik Mansuroglu and Piotr Czarnik and Jian-Xin Zhu and Michael J. Hartmann and Lukasz Cincio and Andrew T. Sornborger and Zoë Holmes,Large-scale simulations of Floquet physics on near-term quantum computers,article,eckstein2023largescale,,,,,,,,,quant-ph,arXiv,2303.02209,
https://arxiv.org/abs/2303.13476,,,,,,3,2023,,Alessandro Summer and Cecilia Chiaracane and Mark T. Mitchison and John Goold,Calculating the many-body density of states on a digital quantum computer,article,summer2023calculating,,,,,,,,,quant-ph,arXiv,2303.13476,
https://link.aps.org/doi/10.1103/PhysRevD.107.054512,10.1103/PhysRevD.107.054512,American Physical Society,054512,,107,3,2023,Phys. Rev. D,"Farrell, Roland C. and Chernyshev, Ivan A. and Powell, Sarah J. M. and Zemlevskiy, Nikita A. and Illa, Marc and Savage, Martin J.",Preparations for quantum simulations of quantum chromodynamics in $1+1$ dimensions. I. Axial gauge,article,PhysRevD.107.054512,,,,,43,5,,,,,,
https://arxiv.org/abs/2305.01650,https://doi.org/10.48550/arXiv.2305.01650,,,,,5,2023,,Reza Haghshenas and Eli Chertkov and Matthew DeCross and Thomas M. Gatterman and Justin A. Gerber and Kevin Gilmore and Dan Gresh and Nathan Hewitt and Chandler V. Horst and Mitchell Matheny and Tanner Mengle and Brian Neyenhuis and David Hayes and Michael Foss-Feig,Probing critical states of matter on a digital quantum computer,article,haghshenas2023probing,,,,,,,,,quant-ph,arXiv,2305.01650,
https://arxiv.org/abs/2305.03857,https://doi.org/10.48550/arXiv.2305.03857,,,,,5,2023,,Zichang He and Ruslan Shaydulin and Shouvanik Chakrabarti and Dylan Herman and Changhao Li and Yue Sun and Marco Pistoia,Alignment between Initial State and Mixer Improves QAOA Performance for Constrained Portfolio Optimization,article,he2023alignment,,,,,,,,,quant-ph,arXiv,2305.03857,
https://arxiv.org/abs/2210.05526,https://doi.org/10.48550/arXiv.2210.05526,,,,,5,2023,,Sebastian Leontica and David Amaro,Exploring the neighborhood of 1-layer QAOA with Instantaneous Quantum Polynomial circuits,article,leontica2023exploring,,,,,,,,,quant-ph,arXiv,2210.05526,
https://link.aps.org/doi/10.1103/PhysRevLett.130.221003,10.1103/PhysRevLett.130.221003,American Physical Society,221003,,130,May,2023,Phys. Rev. Lett.,"Illa, Marc and Savage, Martin J.",Multi-Neutrino Entanglement and Correlations in Dense Neutrino Systems,article,PhysRevLett.130.221003,,,,,7,22,,,,,,
https://arxiv.org/abs/2305.09518,https://doi.org/10.48550/arXiv.2305.09518,,,,,6,2023,,Olivier Ezratty,Where are we heading with NISQ?,article,ezratty2023heading,,,,,,,,,quant-ph,arXiv,2305.09518,
https://arxiv.org/abs/2305.19383,https://doi.org/10.48550/arXiv.2305.19383,,,,,6,2023,,Srinjoy Ganguly and Sai Nandan Morapakula and Luis Miguel Pozo Coronado,Quantum Natural Language Processing based Sentiment Analysis using lambeq Toolkit,article,ganguly2023quantum,,,,,,,,,quant-ph,arXiv,2305.19383,
https://arxiv.org/abs/2306.00494,https://doi.org/10.48550/arXiv.2306.00494,,,,,1,2023,,Moises Ponce and Rebekah Herrman and Phillip C. Lotshaw and Sarah Powers and George Siopsis and Travis Humble and James Ostrowski,Graph decomposition techniques for solving combinatorial optimization problems with variational quantum algorithms,article,ponce2023graph,,,,,,,,,quant-ph,arXiv,2306.00494,
https://arxiv.org/abs/2306.03238,https://doi.org/10.48550/arXiv.2306.03238,,,,,6,2023,,Elijah Pelofske and Andreas Bärtschi and John Golden and Stephan Eidenbenz,High-Round QAOA for MAX $k$-SAT on Trapped Ion NISQ Devices,article,pelofske2023highround,,,,,,,,,quant-ph,arXiv,2306.03238,
https://arxiv.org/abs/2306.13727,https://doi.org/10.48550/arXiv.2306.13727,,,,,6,2023,,Madjid Tehrani and Eldar Sultanow and William J Buchanan and Malik Amir and Anja Jeschke and Raymond Chow and Mouad Lemoudden,Enabling Quantum Cybersecurity Analytics in Botnet Detection: Stable Architecture and Speed-up through Tree Algorithms,article,tehrani2023enabling,,,,,,,,,quant-ph,arXiv,2306.13727,
https://arxiv.org/abs/2306.16608,https://doi.org/10.48550/arXiv.2306.16608,,,,,6,2023,,Kentaro Yamamoto and Samuel Duffield and Yuta Kikuchi and David Muñoz Ramo,Demonstrating Bayesian Quantum Phase Estimation with Quantum Error Detection,article,yamamoto2023demonstrating,,,,,,,,,quant-ph,arXiv,2306.16608,
 https://doi.org/10.1021/acs.jpclett.3c01106,10.1021/acs.jpclett.3c01106,,5511-5516,24,14,6,2023,The Journal of Physical Chemistry Letters,"Claudino, Daniel and Peng, Bo and Kowalski, Karol and Humble, Travis S.",Modeling Singlet Fission on a Quantum Computer,article,doi:10.1021/acs.jpclett.3c01106,,,,,,,,,,, https://doi.org/10.1021/acs.jpclett.3c01106,PMID: 37289995
https://link.aps.org/doi/10.1103/PhysRevApplied.20.014024,10.1103/PhysRevApplied.20.014024,American Physical Society,014024,,20,7,2023,Phys. Rev. Appl.,"Chandarana, Pranav and Hegade, Narendra N. and Montalban, Iraitz and Solano, Enrique and Chen, Xi",Digitized Counterdiabatic Quantum Algorithm for Protein Folding,article,PhysRevApplied.20.014024,,,,,16,1,,,,,,
https://arxiv.org/abs/2209.15024,,,,,,7,2023,,Dylan Herman and Ruslan Shaydulin and Yue Sun and Shouvanik Chakrabarti and Shaohan Hu and Pierre Minssen and Arthur Rattew and Romina Yalovetzky and Marco Pistoia,Constrained Optimization via Quantum Zeno Dynamics,article,herman2023constrained,,,,,,,,,quant-ph,arXiv,2209.15024,
https://doi.org/10.1038/s42005-023-01331-9,10.1038/s42005-023-01331-9,,219,1,6,Aug,2023,Communications Physics,"Herman, Dylan and Shaydulin, Ruslan and Sun, Yue and Chakrabarti, Shouvanik and Hu, Shaohan and Minssen, Pierre and Rattew, Arthur and Yalovetzky, Romina and Pistoia, Marco",Constrained optimization via quantum Zeno dynamics,article,Herman2023,,2399-3650,,,,,,18,,,,
https://arxiv.org/abs/2308.07865,https://doi.org/10.48550/arXiv.2308.07865,,,,,8,2023,,Carys Harvey and Richie Yeung and Konstantinos Meichanetzidis,Sequence Processing with Quantum Tensor Networks,article,harvey2023sequence,,,,,,,,,quant-ph,arXiv,2308.07865,
https://arxiv.org/abs/2308.02342,https://doi.org/10.48550/arXiv.2308.02342,,,,,8,2023,,Ruslan Shaydulin and Changhao Li and Shouvanik Chakrabarti and Matthew DeCross and Dylan Herman and Niraj Kumar and Jeffrey Larson and Danylo Lykov and Pierre Minssen and Yue Sun and Yuri Alexeev and Joan M. Dreiling and John P. Gaebler and Thomas M. Gatterman and Justin A. Gerber and Kevin Gilmore and Dan Gresh and Nathan Hewitt and Chandler V. Horst and Shaohan Hu and Jacob Johansen and Mitchell Matheny and Tanner Mengle and Michael Mills and Steven A. Moses and Brian Neyenhuis and Peter Siegfried and Romina Yalovetzky and Marco Pistoia,Evidence of Scaling Advantage for the Quantum Approximate Optimization Algorithm on a Classically Intractable Problem,article,shaydulin2023evidence,,,,,,,,,quant-ph,arXiv,2308.02342,
https://doi.org/10.1038/s42005-023-01331-9,10.1038/s42005-023-01331-9,,219,1,6,8,2023,Communications Physics,"Herman, Dylan and Shaydulin, Ruslan and Sun, Yue and Chakrabarti, Shouvanik and Hu, Shaohan and Minssen, Pierre and Rattew, Arthur and Yalovetzky, Romina and Pistoia, Marco",Constrained optimization via quantum Zeno dynamics,article,Herman2023,,2399-3650,,,,,,18,,,,
https://link.aps.org/doi/10.1103/PRXQuantum.4.030334,10.1103/PRXQuantum.4.030334,American Physical Society,030334,,4,9,2023,PRX Quantum,"Anand, Sajant and Hauschild, Johannes and Zhang, Yuxuan and Potter, Andrew C. and Zaletel, Michael P.",Holographic Quantum Simulation of Entanglement Renormalization Circuits,article,PRXQuantum.4.030334,,,,,12,3,,,,,,
https://doi.org/10.1038/s41534-023-00762-0,10.1038/s41534-023-00762-0,,93,1,9,9,2023,npj Quantum Information,"Kikuchi, Yuta and Mc Keever, Conor and Coopmans, Luuk and Lubasch, Michael and Benedetti, Marcello",Realization of quantum signal processing on a noisy quantum computer,article,Kikuchi2023,,2056-6387,,,,,,23,,,,
https://doi.org/10.22331/q-2023-09-26-1121,10.22331/q-2023-09-26-1121,"{Verein zur F{\""{o}}rderung des Open Access Publizierens in den Quantenwissenschaften}",1121,,7,9,2023,Quantum,"Tate, Reuben and Moondra, Jai and Gard, Bryan and Mohler, Greg and Gupta, Swati",Warm-{S}tarted {QAOA} with {C}ustom {M}ixers {P}rovably {C}onverges and {C}omputationally {B}eats {G}oemans-{W}illiamson's {M}ax-{C}ut at {L}ow {C}ircuit {D}epths,article,Tate2023warmstartedqaoa,,2521-327X,,,,,,,,,,
https://doi.org/10.22331%2Fq-2023-10-12-1138,10.22331/q-2023-10-12-1138,Verein zur Forderung des Open Access Publizierens in den Quantenwissenschaften,1138,,7,10,2023,Quantum,Illya Shapoval and Vincent Paul Su and Wibe de Jong and Miro Urbanek and Brian Swingle,Towards Quantum Gravity in the Lab on Quantum Processors,article,Shapoval_2023,,,,,,,,,,,,
https://doi.org/10.1088%2F2058-9565%2Facfc62,10.1088/2058-9565/acfc62,IOP Publishing,015002,1,9,10,2023,Quantum Science and Technology,Mudassir Moosa and Thomas W Watts and Yiyou Chen and Abhijat Sarma and Peter L McMahon,Linear-depth quantum circuits for loading Fourier approximations of arbitrary functions,article,Moosa_2023,,,,,,,,,,,,
https://doi.org/10.22331/q-2023-10-12-1138,10.22331/q-2023-10-12-1138,"{Verein zur F{\""{o}}rderung des Open Access Publizierens in den Quantenwissenschaften}",1138,,7,10,2023,{Quantum},"Shapoval, Illya and Su, Vincent Paul and Jong, Wibe de and Urbanek, Miro and Swingle, Brian",Towards {Q}uantum {G}ravity in the {L}ab on {Q}uantum {P}rocessors,article,Shapoval2023towardsquantum,,2521-327X,,,,,,,,,,
https://arxiv.org/abs/2311.00058,https://doi.org/10.48550/arXiv.2311.00058,,,,,11,2023,,Utkarsh Agrawal and Javier Lopez-Piqueres and Romain Vasseur and Sarang Gopalakrishnan and Andrew C. Potter,Observing quantum measurement collapse as a learnability phase transition,article,agrawal2023observing,,,,,,,,,quant-ph,arXiv,2311.00058,
https://arxiv.org/abs/2401.02207,https://doi.org/10.48550/arXiv.2401.02207,,,,,1,2024,,Etienne Granet and Henrik Dreyer,A noise-limiting quantum algorithm using mid-circuit measurements for dynamical correlations at infinite temperature,article,granet2024noiselimiting,,,,,,,,,quant-ph,arXiv,2401.02207,
https://arxiv.org/abs/2401.03015,https://doi.org/10.48550/arXiv.2401.03015,,,,,1,2024,,Aaron Szasz and Ed Younis and Wibe Albert de Jong,Ground state energy and magnetization curve of a frustrated magnetic system from real-time evolution on a digital quantum processor,article,szasz2024ground,,,,,,,,,quant-ph,arXiv,2401.03015,
https://arxiv.org/abs/2401.13793,https://doi.org/10.48550/arXiv.2401.13793,,,,,1,2024,,Aliza U. Siddiqui and Kaitlin Gili and Chris Ballance,Stressing Out Modern Quantum Hardware: Performance Evaluation and Execution Insights,article,siddiqui2024stressing,,,,,,,,,quant-ph,arXiv,2401.13793,
https://arxiv.org/abs/2401.03015,https://doi.org/10.48550/arXiv.2401.03015,,,,,1,2024,,Aaron Szasz and Ed Younis and Wibe Albert de Jong,Ground state energy and magnetization curve of a frustrated magnetic system from real-time evolution on a digital quantum processor,article,szasz2024ground,,,,,,,,,quant-ph,arXiv,2401.03015,
https://arxiv.org/abs/2402.04221,https://doi.org/10.48550/arXiv.2402.04221,,,,,1,2024,,Francesco Turro and Xiaojun Yao,Classical and Quantum Computing of Shear Viscosity for $2+1D$ SU(2) Gauge Theory,misc,turro2024classical,,,,,,,,,hep-lat,arXiv,2402.04221,
