url,doi,publisher,pages,number,volume,month,year,journal,author,title,ENTRYTYPE,ID,place,issn,copyright,keywords,numpages,issue,abstract,day,primaryclass,archiveprefix,eprint,note
https://arxiv.org/abs/2402.00840,https://doi.org/10.48550/arXiv.2402.00840,,,,,2,2024,,Zohreh Davoudi and Chung-Chun Hsieh and Saurabh V. Kadam,Scattering wave packets of hadrons in gauge theories: Preparation on a quantum computer,article,davoudi2024scattering,,,,,,,,,quant-ph,arXiv,2402.00840,
https://arxiv.org/abs/2402.13960,https://doi.org/10.48550/arXiv.2402.13960,,,,,2,2024,,Shuo Sun and Chandan Kumar and Kevin Shen and Elvira Shishenina and Christian B. Mendl,Evaluating Ground State Energies of Chemical Systems with Low-Depth Quantum Circuits and High Accuracy,article,sun2024evaluating,,,,,,,,,quant-ph,arXiv,2402.13960,
https://arxiv.org/abs/2404.14299,https://doi.org/10.48550/arXiv.2404.14299,,,,,4,2024,,Elaine Wong and Vicente Leyton Ortega and Daniel Claudino and Seth Johnson and Sharmin Afrose and Meenambika Gowrishankar and Anthony M. Cabrera and Travis S. Humble,A Cross-Platform Execution Engine for the Quantum Intermediate Representation,article,wong2024crossplatform,,,,,,,,,quant-ph,arXiv,2404.14299,
https://arxiv.org/abs/2405.09169,https://doi.org/10.48550/arXiv.2405.09169,,,,,5,2024,,J. A. Montanez-Barrera and Kristel Michielsen,Towards a universal QAOA protocol: Evidence of quantum advantage in solving combinatorial optimization problems,article,montanezbarrera2024universal,,,,,,,,,quant-ph,arXiv,2405.09169,
https://arxiv.org/abs/2406.05294,https://doi.org/10.48550/arXiv.2406.05294,,,,,6,2024,,Bhaskar Gaur and Travis S. Humble and Himanshu Thapliyal,Residue Number System (RNS) based Distributed Quantum Addition,article,gaur2024residuenumberrnsbased,,,,,,,,,quant-ph,arXiv,2406.05294,
https://arxiv.org/abs/2406.15557,https://doi.org/10.48550/arXiv.2406.15557,,,,,6,2024,,Yuxuan Zhang and Juan Carrasquilla and Yong Baek Kim,Observation of a non-Hermitian supersonic mode,article,zhang2024observationnonhermitiansupersonicmode,,,,,,,,,quant-ph,arXiv,2406.15557,
https://arxiv.org/abs/2408.08865,https://doi.org/10.48550/arXiv.2408.08865,,,,,6,2024,,Francesco Turro and Ivan A. Chernyshev and Ramya Bhaskar and Marc Illa,Qutrit and Qubit Circuits for Three-Flavor Collective Neutrino Oscillations,article,turro2024qutritqubitcircuitsthreeflavor,,,,,,,,,quant-ph,arXiv,2407.13914,
test,test,,,,,9,2024,,test,Zach Testing,article,turro2024qutritqubitcircuitsthreeflavor,,,,,,,,,quant-ph,arXiv,test,
